{
    "voice_banks": {
        "soft": {
            "clips": ["soft_1.ogg", "soft_2.ogg", "soft_3.ogg"]
        },
        "loud": {
            "clips": ["loud_1.ogg", "loud_2.ogg"]
        }
    },
    "sfx": {
        "orgasm":     ["orgasm_1.ogg", "orgasm_2.ogg"],
        "bj_slurp":   ["slurp_1.ogg", "slurp_2.ogg"],
        "bj_gag":     ["gag_1.ogg"],
        "bj_moan":    ["bj_moan_1.ogg"],
        "bj_breathe": ["breathe_1.ogg"]
    },
    "voice_map": {
        "10": {"bank": "soft", "pitch": 0.98},
        "13": {"bank": "loud", "pitch": 1.10}
    },
    "settings_defaults": {
        "moan_vol": 0.5,
        "moan_frq": 15,
        "orgasm_frq": 5,
        "plap_vol": 0.5,
        "ej_vol": 0.5,
        "bj_vol": 0.5
    }
}
